Neimark/Day 2/my_mnist_model.autotvm.gpu.android.log
{"input": ["opencl -keys=adreno,opencl,gpu -device=adreno -max_num_threads=256 -texture_spatial_limit=16384 -thread_warp_size=1", "conv2d_nhwc_winograd.image2d", [["TENSOR", [1, 28, 28, 1], "float32"], ["TENSOR", [3, 3, 1, 64], "float32"], [1, 1], [0, 0, 0, 0], [1, 1], "float32"], {}], "config": {"index": 168, "code_hash": null, "entity": [["auto_unroll_max_step", "ot", 0], ["tile_y", "sp", [-1, 4, 4]], ["tile_x", "sp", [-1, 13, 13]], ["tile_rc", "sp", [-1, 1]]]}, "result": [[0.00183456, 0.001839296, 0.001840768, 0.001853632, 0.001855424, 0.001863488, 0.001865344, 0.0018704639999999999], 0, 10.40425181388855, 1675925478.8196638], "version": 0.2, "tvm_version": "0.11.dev0"}
{"input": ["opencl -keys=adreno,opencl,gpu -device=adreno -max_num_threads=256 -texture_spatial_limit=16384 -thread_warp_size=1", "conv2d_nhwc_winograd.image2d", [["TENSOR", [1, 28, 28, 1], "float32"], ["TENSOR", [3, 3, 1, 64], "float32"], [1, 1], [0, 0, 0, 0], [1, 1], "float32"], {}], "config": {"index": 130, "code_hash": null, "entity": [["auto_unroll_max_step", "ot", 4], ["tile_y", "sp", [-1, 2, 8]], ["tile_x", "sp", [-1, 1, 13]], ["tile_rc", "sp", [-1, 1]]]}, "result": [[7.4752e-05, 7.5136e-05, 7.5904e-05, 7.7696e-05, 7.8016e-05, 7.8336e-05, 7.968e-05, 7.9744e-05], 0, 8.919890403747559, 1675925477.402516], "version": 0.2, "tvm_version": "0.11.dev0"}
{"input": ["opencl -keys=adreno,opencl,gpu -device=adreno -max_num_threads=256 -texture_spatial_limit=16384 -thread_warp_size=1", "conv2d_nhwc_winograd.image2d", [["TENSOR", [1, 28, 28, 1], "float32"], ["TENSOR", [3, 3, 1, 64], "float32"], [1, 1], [0, 0, 0, 0], [1, 1], "float32"], {}], "config": {"index": 163, "code_hash": null, "entity": [["auto_unroll_max_step", "ot", 4], ["tile_y", "sp", [-1, 1, 4]], ["tile_x", "sp", [-1, 13, 13]], ["tile_rc", "sp", [-1, 1]]]}, "result": [[7.929600000000001e-05, 7.968e-05, 7.9808e-05, 8.1152e-05, 8.2304e-05, 8.3648e-05, 8.4416e-05, 8.537599999999999e-05], 0, 8.318794012069702, 1675925476.800979], "version": 0.2, "tvm_version": "0.11.dev0"}
{"input": ["opencl -keys=adreno,opencl,gpu -device=adreno -max_num_threads=256 -texture_spatial_limit=16384 -thread_warp_size=1", "conv2d_nhwc_winograd.image2d", [["TENSOR", [1, 28, 28, 1], "float32"], ["TENSOR", [3, 3, 1, 64], "float32"], [1, 1], [0, 0, 0, 0], [1, 1], "float32"], {}], "config": {"index": 179, "code_hash": null, "entity": [["auto_unroll_max_step", "ot", 16], ["tile_y", "sp", [-1, 1, 16]], ["tile_x", "sp", [-1, 13, 13]], ["tile_rc", "sp", [-1, 1]]]}, "result": [[7.167999999999999e-05, 7.2192e-05, 7.264e-05, 7.264e-05, 7.2832e-05, 7.328e-05, 7.398399999999999e-05, 7.4368e-05], 0, 9.541975975036621, 1675925478.024578], "version": 0.2, "tvm_version": "0.11.dev0"}
{"input": ["opencl -keys=adreno,opencl,gpu -device=adreno -max_num_threads=256 -texture_spatial_limit=16384 -thread_warp_size=1", "conv2d_nhwc_winograd.image2d", [["TENSOR", [1, 28, 28, 1], "float32"], ["TENSOR", [3, 3, 1, 64], "float32"], [1, 1], [0, 0, 0, 0], [1, 1], "float32"], {}], "config": {"index": 128, "code_hash": null, "entity": [["auto_unroll_max_step", "ot", 16], ["tile_y", "sp", [-1, 1, 8]], ["tile_x", "sp", [-1, 1, 13]], ["tile_rc", "sp", [-1, 1]]]}, "result": [[7.948800000000001e-05, 7.9808e-05, 8.0448e-05, 8.076800000000001e-05, 8.128000000000001e-05, 8.2368e-05, 8.4416e-05, 8.48e-05], 0, 7.680310010910034, 1675925476.165534], "version": 0.2, "tvm_version": "0.11.dev0"}
{"input": ["opencl -keys=adreno,opencl,gpu -device=adreno -max_num_threads=256 -texture_spatial_limit=16384 -thread_warp_size=1", "conv2d_nhwc_winograd.image2d", [["TENSOR", [1, 28, 28, 1], "float32"], ["TENSOR", [3, 3, 1, 64], "float32"], [1, 1], [0, 0, 0, 0], [1, 1], "float32"], {}], "config": {"index": 121, "code_hash": null, "entity": [["auto_unroll_max_step", "ot", 4], ["tile_y", "sp", [-1, 2, 4]], ["tile_x", "sp", [-1, 1, 13]], ["tile_rc", "sp", [-1, 1]]]}, "result": [[8.537599999999999e-05, 8.5568e-05, 8.608e-05, 8.6144e-05, 8.7104e-05, 8.735999999999999e-05, 8.8e-05, 8.8064e-05], 0, 7.073225021362305, 1675925475.5570729], "version": 0.2, "tvm_version": "0.11.dev0"}
{"input": ["opencl -keys=adreno,opencl,gpu -device=adreno -max_num_threads=256 -texture_spatial_limit=16384 -thread_warp_size=1", "conv2d_nhwc_winograd.image2d", [["TENSOR", [1, 28, 28, 1], "float32"], ["TENSOR", [3, 3, 1, 64], "float32"], [1, 1], [0, 0, 0, 0], [1, 1], "float32"], {}], "config": {"index": 178, "code_hash": null, "entity": [["auto_unroll_max_step", "ot", 4], ["tile_y", "sp", [-1, 1, 16]], ["tile_x", "sp", [-1, 13, 13]], ["tile_rc", "sp", [-1, 1]]]}, "result": [[6.6368e-05, 6.7328e-05, 6.758400000000001e-05, 6.7648e-05, 6.771199999999999e-05, 6.771199999999999e-05, 6.7904e-05, 6.8032e-05], 0, 4.342003583908081, 1675925520.7158668], "version": 0.2, "tvm_version": "0.11.dev0"}
{"input": ["opencl -keys=adreno,opencl,gpu -device=adreno -max_num_threads=256 -texture_spatial_limit=16384 -thread_warp_size=1", "conv2d_nhwc_winograd.image2d", [["TENSOR", [1, 28, 28, 1], "float32"], ["TENSOR", [3, 3, 1, 64], "float32"], [1, 1], [0, 0, 0, 0], [1, 1], "float32"], {}], "config": {"index": 119, "code_hash": null, "entity": [["auto_unroll_max_step", "ot", 16], ["tile_y", "sp", [-1, 1, 4]], ["tile_x", "sp", [-1, 1, 13]], ["tile_rc", "sp", [-1, 1]]]}, "result": [[7.295999999999999e-05, 7.295999999999999e-05, 7.3216e-05, 7.334400000000001e-05, 7.366399999999999e-05, 7.366399999999999e-05, 7.3728e-05, 7.392e-05], 0, 11.078037023544312, 1675925537.685148], "version": 0.2, "tvm_version": "0.11.dev0"}
{"input": ["opencl -keys=adreno,opencl,gpu -device=adreno -max_num_threads=256 -texture_spatial_limit=16384 -thread_warp_size=1", "conv2d_nhwc_winograd.image2d", [["TENSOR", [1, 28, 28, 1], "float32"], ["TENSOR", [3, 3, 1, 64], "float32"], [1, 1], [0, 0, 0, 0], [1, 1], "float32"], {}], "config": {"index": 126, "code_hash": null, "entity": [["auto_unroll_max_step", "ot", 0], ["tile_y", "sp", [-1, 1, 8]], ["tile_x", "sp", [-1, 1, 13]], ["tile_rc", "sp", [-1, 1]]]}, "result": [[6.771199999999999e-05, 6.784e-05, 6.8096e-05, 6.816e-05, 6.8224e-05, 6.8352e-05, 6.848e-05, 6.8544e-05], 0, 6.917579650878906, 1675925533.627483], "version": 0.2, "tvm_version": "0.11.dev0"}
{"input": ["opencl -keys=adreno,opencl,gpu -device=adreno -max_num_threads=256 -texture_spatial_limit=16384 -thread_warp_size=1", "conv2d_nhwc_winograd.image2d", [["TENSOR", [1, 28, 28, 1], "float32"], ["TENSOR", [3, 3, 1, 64], "float32"], [1, 1], [0, 0, 0, 0], [1, 1], "float32"], {}], "config": {"index": 174, "code_hash": null, "entity": [["auto_unroll_max_step", "ot", 0], ["tile_y", "sp", [-1, 2, 8]], ["tile_x", "sp", [-1, 13, 13]], ["tile_rc", "sp", [-1, 1]]]}, "result": [[6.4192e-05, 6.4768e-05, 6.4832e-05, 6.496e-05, 6.502399999999999e-05, 6.5408e-05, 6.579200000000001e-05, 6.5856e-05], 0, 6.6463563442230225, 1675925533.0359292], "version": 0.2, "tvm_version": "0.11.dev0"}
{"input": ["opencl -keys=adreno,opencl,gpu -device=adreno -max_num_threads=256 -texture_spatial_limit=16384 -thread_warp_size=1", "conv2d_nhwc_winograd.image2d", [["TENSOR", [1, 28, 28, 1], "float32"], ["TENSOR", [3, 3, 1, 64], "float32"], [1, 1], [0, 0, 0, 0], [1, 1], "float32"], {}], "config": {"index": 120, "code_hash": null, "entity": [["auto_unroll_max_step", "ot", 0], ["tile_y", "sp", [-1, 2, 4]], ["tile_x", "sp", [-1, 1, 13]], ["tile_rc", "sp", [-1, 1]]]}, "result": [[7.3408e-05, 7.347199999999999e-05, 7.353600000000001e-05, 7.3728e-05, 7.3792e-05, 7.398399999999999e-05, 7.4176e-05, 7.4176e-05], 0, 8.356724977493286, 1675925534.998711], "version": 0.2, "tvm_version": "0.11.dev0"}
{"input": ["opencl -keys=adreno,opencl,gpu -device=adreno -max_num_threads=256 -texture_spatial_limit=16384 -thread_warp_size=1", "conv2d_nhwc_winograd.image2d", [["TENSOR", [1, 28, 28, 1], "float32"], ["TENSOR", [3, 3, 1, 64], "float32"], [1, 1], [0, 0, 0, 0], [1, 1], "float32"], {}], "config": {"index": 169, "code_hash": null, "entity": [["auto_unroll_max_step", "ot", 4], ["tile_y", "sp", [-1, 4, 4]], ["tile_x", "sp", [-1, 13, 13]], ["tile_rc", "sp", [-1, 1]]]}, "result": [[0.0018304640000000002, 0.001852864, 0.0018549119999999998, 0.0018675839999999998, 0.001872704, 0.001872768, 0.001883712, 0.001885952], 0, 9.58362889289856, 1675925535.8036668], "version": 0.2, "tvm_version": "0.11.dev0"}
{"input": ["opencl -keys=adreno,opencl,gpu -device=adreno -max_num_threads=256 -texture_spatial_limit=16384 -thread_warp_size=1", "conv2d_nhwc_winograd.image2d", [["TENSOR", [1, 28, 28, 1], "float32"], ["TENSOR", [3, 3, 1, 64], "float32"], [1, 1], [0, 0, 0, 0], [1, 1], "float32"], {}], "config": {"index": 128, "code_hash": null, "entity": [["auto_unroll_max_step", "ot", 16], ["tile_y", "sp", [-1, 1, 8]], ["tile_x", "sp", [-1, 1, 13]], ["tile_rc", "sp", [-1, 1]]]}, "result": [[6.6752e-05, 6.6816e-05, 6.688e-05, 6.6944e-05, 6.700799999999999e-05, 6.7328e-05, 6.7648e-05, 6.7968e-05], 0, 9.715720176696777, 1675925536.418546], "version": 0.2, "tvm_version": "0.11.dev0"}
{"input": ["opencl -keys=adreno,opencl,gpu -device=adreno -max_num_threads=256 -texture_spatial_limit=16384 -thread_warp_size=1", "conv2d_nhwc_winograd.image2d", [["TENSOR", [1, 28, 28, 1], "float32"], ["TENSOR", [3, 3, 1, 64], "float32"], [1, 1], [0, 0, 0, 0], [1, 1], "float32"], {}], "config": {"index": 170, "code_hash": null, "entity": [["auto_unroll_max_step", "ot", 16], ["tile_y", "sp", [-1, 4, 4]], ["tile_x", "sp", [-1, 13, 13]], ["tile_rc", "sp", [-1, 1]]]}, "result": [[0.0018800639999999999, 0.0018813439999999999, 0.0018902399999999998, 0.0019013119999999998, 0.001910784, 0.001917696, 0.001924032, 0.001931264], 0, 8.13555121421814, 1675925534.409122], "version": 0.2, "tvm_version": "0.11.dev0"}
{"input": ["opencl -keys=adreno,opencl,gpu -device=adreno -max_num_threads=256 -texture_spatial_limit=16384 -thread_warp_size=1", "conv2d_nhwc_winograd.image2d", [["TENSOR", [1, 28, 28, 1], "float32"], ["TENSOR", [3, 3, 1, 64], "float32"], [1, 1], [0, 0, 0, 0], [1, 1], "float32"], {}], "config": {"index": 162, "code_hash": null, "entity": [["auto_unroll_max_step", "ot", 0], ["tile_y", "sp", [-1, 1, 4]], ["tile_x", "sp", [-1, 13, 13]], ["tile_rc", "sp", [-1, 1]]]}, "result": [[6.528e-05, 6.5472e-05, 6.592e-05, 6.6048e-05, 6.6176e-05, 6.623999999999999e-05, 6.623999999999999e-05, 6.623999999999999e-05], 0, 10.419416904449463, 1675925537.0709262], "version": 0.2, "tvm_version": "0.11.dev0"}
{"input": ["opencl -keys=adreno,opencl,gpu -device=adreno -max_num_threads=256 -texture_spatial_limit=16384 -thread_warp_size=1", "conv2d_nhwc_winograd.image2d", [["TENSOR", [1, 28, 28, 1], "float32"], ["TENSOR", [3, 3, 1, 64], "float32"], [1, 1], [0, 0, 0, 0], [1, 1], "float32"], {}], "config": {"index": 118, "code_hash": null, "entity": [["auto_unroll_max_step", "ot", 4], ["tile_y", "sp", [-1, 1, 4]], ["tile_x", "sp", [-1, 1, 13]], ["tile_rc", "sp", [-1, 1]]]}, "result": [[7.36e-05, 7.3728e-05, 7.3792e-05, 7.3792e-05, 7.4112e-05, 7.4304e-05, 7.4304e-05, 7.500800000000001e-05], 0, 6.3504180908203125, 1675925530.648041], "version": 0.2, "tvm_version": "0.11.dev0"}
{"input": ["opencl -keys=adreno,opencl,gpu -device=adreno -max_num_threads=256 -texture_spatial_limit=16384 -thread_warp_size=1", "conv2d_nhwc_winograd.image2d", [["TENSOR", [1, 28, 28, 1], "float32"], ["TENSOR", [3, 3, 1, 64], "float32"], [1, 1], [0, 0, 0, 0], [1, 1], "float32"], {}], "config": {"index": 172, "code_hash": null, "entity": [["auto_unroll_max_step", "ot", 4], ["tile_y", "sp", [-1, 1, 8]], ["tile_x", "sp", [-1, 13, 13]], ["tile_rc", "sp", [-1, 1]]]}, "result": [[6.572799999999999e-05, 6.572799999999999e-05, 6.579200000000001e-05, 6.5856e-05, 6.5984e-05, 6.5984e-05, 6.623999999999999e-05, 6.623999999999999e-05], 0, 7.096006155014038, 1675925531.255593], "version": 0.2, "tvm_version": "0.11.dev0"}
{"input": ["opencl -keys=adreno,opencl,gpu -device=adreno -max_num_threads=256 -texture_spatial_limit=16384 -thread_warp_size=1", "conv2d_nhwc_winograd.image2d", [["TENSOR", [1, 28, 28, 1], "float32"], ["TENSOR", [3, 3, 1, 64], "float32"], [1, 1], [0, 0, 0, 0], [1, 1], "float32"], {}], "config": {"index": 127, "code_hash": null, "entity": [["auto_unroll_max_step", "ot", 4], ["tile_y", "sp", [-1, 1, 8]], ["tile_x", "sp", [-1, 1, 13]], ["tile_rc", "sp", [-1, 1]]]}, "result": [[6.6944e-05, 6.72e-05, 6.7264e-05, 6.751999999999999e-05, 6.758400000000001e-05, 6.7648e-05, 6.7776e-05, 6.8096e-05], 0, 7.544281005859375, 1675925531.84305], "version": 0.2, "tvm_version": "0.11.dev0"}
{"input": ["opencl -keys=adreno,opencl,gpu -device=adreno -max_num_threads=256 -texture_spatial_limit=16384 -thread_warp_size=1", "conv2d_nhwc_winograd.image2d", [["TENSOR", [1, 28, 28, 1], "float32"], ["TENSOR", [3, 3, 1, 64], "float32"], [1, 1], [0, 0, 0, 0], [1, 1], "float32"], {}], "config": {"index": 122, "code_hash": null, "entity": [["auto_unroll_max_step", "ot", 16], ["tile_y", "sp", [-1, 2, 4]], ["tile_x", "sp", [-1, 1, 13]], ["tile_rc", "sp", [-1, 1]]]}, "result": [[7.3216e-05, 7.328e-05, 7.334400000000001e-05, 7.3728e-05, 7.4048e-05, 7.4048e-05, 7.424e-05, 7.449600000000001e-05], 0, 4.573441743850708, 1675925542.542822], "version": 0.2, "tvm_version": "0.11.dev0"}
{"input": ["opencl -keys=adreno,opencl,gpu -device=adreno -max_num_threads=256 -texture_spatial_limit=16384 -thread_warp_size=1", "conv2d_nhwc_winograd.image2d", [["TENSOR", [1, 28, 28, 1], "float32"], ["TENSOR", [3, 3, 1, 64], "float32"], [1, 1], [0, 0, 0, 0], [1, 1], "float32"], {}], "config": {"index": 171, "code_hash": null, "entity": [["auto_unroll_max_step", "ot", 0], ["tile_y", "sp", [-1, 1, 8]], ["tile_x", "sp", [-1, 13, 13]], ["tile_rc", "sp", [-1, 1]]]}, "result": [[6.5664e-05, 6.5856e-05, 6.592e-05, 6.6176e-05, 6.623999999999999e-05, 6.6752e-05, 6.6752e-05, 6.6944e-05], 0, 4.6283111572265625, 1675925544.558468], "version": 0.2, "tvm_version": "0.11.dev0"}
{"input": ["opencl -keys=adreno,opencl,gpu -device=adreno -max_num_threads=256 -texture_spatial_limit=16384 -thread_warp_size=1", "conv2d_nhwc_winograd.image2d", [["TENSOR", [1, 28, 28, 1], "float32"], ["TENSOR", [3, 3, 1, 64], "float32"], [1, 1], [0, 0, 0, 0], [1, 1], "float32"], {}], "config": {"index": 175, "code_hash": null, "entity": [["auto_unroll_max_step", "ot", 4], ["tile_y", "sp", [-1, 2, 8]], ["tile_x", "sp", [-1, 13, 13]], ["tile_rc", "sp", [-1, 1]]]}, "result": [[6.4704e-05, 6.4704e-05, 6.4896e-05, 6.528e-05, 6.5408e-05, 6.5472e-05, 6.5472e-05, 6.553599999999999e-05], 0, 5.357942819595337, 1675925543.18533], "version": 0.2, "tvm_version": "0.11.dev0"}
{"input": ["opencl -keys=adreno,opencl,gpu -device=adreno -max_num_threads=256 -texture_spatial_limit=16384 -thread_warp_size=1", "conv2d_nhwc.image2d", [["TENSOR", [1, 28, 28, 1], "float32"], ["TENSOR", [3, 3, 1, 64], "float32"], [1, 1], [0, 0, 0, 0], [1, 1], "float32"], {}], "config": {"index": 29638, "code_hash": null, "entity": [["tile_fc", "sp", [-1, 2, 8]], ["tile_y", "sp", [-1, 1, 7]], ["tile_x", "sp", [-1, 2, 1]], ["tile_rcc", "sp", [-1, 1]], ["tile_ry", "sp", [-1, 3]], ["tile_rx", "sp", [-1, 3]], ["auto_unroll_max_step", "ot", 0], ["unroll_explicit", "ot", 1]]}, "result": [[4.4992e-05, 4.5311999999999996e-05, 4.5311999999999996e-05, 4.5504000000000003e-05, 4.5504000000000003e-05, 4.5504000000000003e-05, 4.5632e-05, 4.5696e-05], 0, 0.9846649169921875, 1675925548.546942], "version": 0.2, "tvm_version": "0.11.dev0"}
{"input": ["opencl -keys=adreno,opencl,gpu -device=adreno -max_num_threads=256 -texture_spatial_limit=16384 -thread_warp_size=1", "conv2d_nhwc.image2d", [["TENSOR", [1, 28, 28, 1], "float32"], ["TENSOR", [3, 3, 1, 64], "float32"], [1, 1], [0, 0, 0, 0], [1, 1], "float32"], {}], "config": {"index": 36361, "code_hash": null, "entity": [["tile_fc", "sp", [-1, 2, 2]], ["tile_y", "sp", [-1, 2, 7]], ["tile_x", "sp", [-1, 1, 4]], ["tile_rcc", "sp", [-1, 1]], ["tile_ry", "sp", [-1, 1]], ["tile_rx", "sp", [-1, 3]], ["auto_unroll_max_step", "ot", 512], ["unroll_explicit", "ot", 1]]}, "result": [[4.8e-05, 4.8256e-05, 4.8320000000000005e-05, 4.8320000000000005e-05, 4.8448e-05, 4.864e-05, 4.8704e-05, 4.8768e-05], 0, 2.7300376892089844, 1675925549.233305], "version": 0.2, "tvm_version": "0.11.dev0"}
{"input": ["opencl -keys=adreno,opencl,gpu -device=adreno -max_num_threads=256 -texture_spatial_limit=16384 -thread_warp_size=1", "conv2d_nhwc.image2d", [["TENSOR", [1, 28, 28, 1], "float32"], ["TENSOR", [3, 3, 1, 64], "float32"], [1, 1], [0, 0, 0, 0], [1, 1], "float32"], {}], "config": {"index": 40934, "code_hash": null, "entity": [["tile_fc", "sp", [-1, 1, 4]], ["tile_y", "sp", [-1, 2, 2]], ["tile_x", "sp", [-1, 1, 14]], ["tile_rcc", "sp", [-1, 1]], ["tile_ry", "sp", [-1, 1]], ["tile_rx", "sp", [-1, 1]], ["auto_unroll_max_step", "ot", 1500], ["unroll_explicit", "ot", 1]]}, "result": [[4.544e-05, 4.5696e-05, 4.576e-05, 4.6016e-05, 4.6208e-05, 4.6464e-05, 4.6784e-05, 4.6784e-05], 0, 3.40535306930542, 1675925550.484405], "version": 0.2, "tvm_version": "0.11.dev0"}
{"input": ["opencl -keys=adreno,opencl,gpu -device=adreno -max_num_threads=256 -texture_spatial_limit=16384 -thread_warp_size=1", "conv2d_nhwc.image2d", [["TENSOR", [1, 28, 28, 1], "float32"], ["TENSOR", [3, 3, 1, 64], "float32"], [1, 1], [0, 0, 0, 0], [1, 1], "float32"], {}], "config": {"index": 29789, "code_hash": null, "entity": [["tile_fc", "sp", [-1, 1, 16]], ["tile_y", "sp", [-1, 2, 7]], ["tile_x", "sp", [-1, 4, 1]], ["tile_rcc", "sp", [-1, 1]], ["tile_ry", "sp", [-1, 3]], ["tile_rx", "sp", [-1, 3]], ["auto_unroll_max_step", "ot", 0], ["unroll_explicit", "ot", 1]]}, "result": [[2.9696e-05, 2.9760000000000003e-05, 2.9824e-05, 2.9824e-05, 2.9952e-05, 3.0208e-05, 3.0208e-05, 3.0208e-05], 0, 2.221571445465088, 1675925549.543639], "version": 0.2, "tvm_version": "0.11.dev0"}
{"input": ["opencl -keys=adreno,opencl,gpu -device=adreno -max_num_threads=256 -texture_spatial_limit=16384 -thread_warp_size=1", "conv2d_nhwc.image2d", [["TENSOR", [1, 28, 28, 1], "float32"], ["TENSOR", [3, 3, 1, 64], "float32"], [1, 1], [0, 0, 0, 0], [1, 1], "float32"], {}], "config": {"index": 3481, "code_hash": null, "entity": [["tile_fc", "sp", [-1, 2, 2]], ["tile_y", "sp", [-1, 1, 14]], ["tile_x", "sp", [-1, 2, 7]], ["tile_rcc", "sp", [-1, 1]], ["tile_ry", "sp", [-1, 3]], ["tile_rx", "sp", [-1, 1]], ["auto_unroll_max_step", "ot", 0], ["unroll_explicit", "ot", 0]]}, "result": [[6.4448e-05, 6.4512e-05, 6.4704e-05, 6.496e-05, 6.572799999999999e-05, 6.623999999999999e-05, 6.6496e-05, 6.6688e-05], 0, 1.140455961227417, 1675925548.847701], "version": 0.2, "tvm_version": "0.11.dev0"}
{"input": ["opencl -keys=adreno,opencl,gpu -device=adreno -max_num_threads=256 -texture_spatial_limit=16384 -thread_warp_size=1", "conv2d_nhwc.image2d", [["TENSOR", [1, 28, 28, 1], "float32"], ["TENSOR", [3, 3, 1, 64], "float32"], [1, 1], [0, 0, 0, 0], [1, 1], "float32"], {}], "config": {"index": 29172, "code_hash": null, "entity": [["tile_fc", "sp", [-1, 4, 2]], ["tile_y", "sp", [-1, 2, 2]], ["tile_x", "sp", [-1, 1, 14]], ["tile_rcc", "sp", [-1, 1]], ["tile_ry", "sp", [-1, 1]], ["tile_rx", "sp", [-1, 3]], ["auto_unroll_max_step", "ot", 0], ["unroll_explicit", "ot", 1]]}, "result": [[4.3904e-05, 4.3968e-05, 4.4032e-05, 4.4224e-05, 4.4224e-05, 4.4288e-05, 4.4288e-05, 4.4415999999999996e-05], 0, 3.57232403755188, 1675925550.7963579], "version": 0.2, "tvm_version": "0.11.dev0"}
{"input": ["opencl -keys=adreno,opencl,gpu -device=adreno -max_num_threads=256 -texture_spatial_limit=16384 -thread_warp_size=1", "conv2d_nhwc.image2d", [["TENSOR", [1, 28, 28, 1], "float32"], ["TENSOR", [3, 3, 1, 64], "float32"], [1, 1], [0, 0, 0, 0], [1, 1], "float32"], {}], "config": {"index": 33509, "code_hash": null, "entity": [["tile_fc", "sp", [-1, 1, 16]], ["tile_y", "sp", [-1, 1, 2]], ["tile_x", "sp", [-1, 2, 1]], ["tile_rcc", "sp", [-1, 1]], ["tile_ry", "sp", [-1, 3]], ["tile_rx", "sp", [-1, 1]], ["auto_unroll_max_step", "ot", 512], ["unroll_explicit", "ot", 1]]}, "result": [[4.0192e-05, 4.0256e-05, 4.0256e-05, 4.0576e-05, 4.096e-05, 4.1152e-05, 4.128e-05, 4.128e-05], 0, 2.565406084060669, 1675925549.8536372], "version": 0.2, "tvm_version": "0.11.dev0"}
{"input": ["opencl -keys=adreno,opencl,gpu -device=adreno -max_num_threads=256 -texture_spatial_limit=16384 -thread_warp_size=1", "conv2d_nhwc.image2d", [["TENSOR", [1, 28, 28, 1], "float32"], ["TENSOR", [3, 3, 1, 64], "float32"], [1, 1], [0, 0, 0, 0], [1, 1], "float32"], {}], "config": {"index": 19068, "code_hash": null, "entity": [["tile_fc", "sp", [-1, 2, 8]], ["tile_y", "sp", [-1, 4, 1]], ["tile_x", "sp", [-1, 2, 7]], ["tile_rcc", "sp", [-1, 1]], ["tile_ry", "sp", [-1, 3]], ["tile_rx", "sp", [-1, 1]], ["auto_unroll_max_step", "ot", 1500], ["unroll_explicit", "ot", 0]]}, "result": [[5.1903999999999996e-05, 5.2032e-05, 5.2224e-05, 5.2415999999999994e-05, 5.248e-05, 5.248e-05, 5.2544000000000004e-05, 5.2736e-05], 0, 4.371526002883911, 1675925551.795198], "version": 0.2, "tvm_version": "0.11.dev0"}
{"input": ["opencl -keys=adreno,opencl,gpu -device=adreno -max_num_threads=256 -texture_spatial_limit=16384 -thread_warp_size=1", "conv2d_nhwc.image2d", [["TENSOR", [1, 28, 28, 1], "float32"], ["TENSOR", [3, 3, 1, 64], "float32"], [1, 1], [0, 0, 0, 0], [1, 1], "float32"], {}], "config": {"index": 5454, "code_hash": null, "entity": [["tile_fc", "sp", [-1, 1, 4]], ["tile_y", "sp", [-1, 2, 14]], ["tile_x", "sp", [-1, 2, 7]], ["tile_rcc", "sp", [-1, 1]], ["tile_ry", "sp", [-1, 1]], ["tile_rx", "sp", [-1, 3]], ["auto_unroll_max_step", "ot", 0], ["unroll_explicit", "ot", 0]]}, "result": [[8.352e-05, 8.3968e-05, 8.473600000000001e-05, 8.576e-05, 8.5824e-05, 8.672000000000001e-05, 8.704000000000001e-05, 8.716799999999999e-05], 0, 2.455274820327759, 1675925550.1674838], "version": 0.2, "tvm_version": "0.11.dev0"}
{"input": ["opencl -keys=adreno,opencl,gpu -device=adreno -max_num_threads=256 -texture_spatial_limit=16384 -thread_warp_size=1", "conv2d_nhwc.image2d", [["TENSOR", [1, 28, 28, 1], "float32"], ["TENSOR", [3, 3, 1, 64], "float32"], [1, 1], [0, 0, 0, 0], [1, 1], "float32"], {}], "config": {"index": 15278, "code_hash": null, "entity": [["tile_fc", "sp", [-1, 2, 8]], ["tile_y", "sp", [-1, 2, 1]], ["tile_x", "sp", [-1, 4, 7]], ["tile_rcc", "sp", [-1, 1]], ["tile_ry", "sp", [-1, 3]], ["tile_rx", "sp", [-1, 3]], ["auto_unroll_max_step", "ot", 512], ["unroll_explicit", "ot", 0]]}, "result": [[5.6767999999999996e-05, 5.6832e-05, 5.7024e-05, 5.7024e-05, 5.7216e-05, 5.7216e-05, 5.728e-05, 5.7472e-05], 0, 3.6640162467956543, 1675925551.153315], "version": 0.2, "tvm_version": "0.11.dev0"}
{"input": ["opencl -keys=adreno,opencl,gpu -device=adreno -max_num_threads=256 -texture_spatial_limit=16384 -thread_warp_size=1", "conv2d_nhwc.image2d", [["TENSOR", [1, 28, 28, 1], "float32"], ["TENSOR", [3, 3, 1, 64], "float32"], [1, 1], [0, 0, 0, 0], [1, 1], "float32"], {}], "config": {"index": 22107, "code_hash": null, "entity": [["tile_fc", "sp", [-1, 1, 8]], ["tile_y", "sp", [-1, 1, 14]], ["tile_x", "sp", [-1, 7, 1]], ["tile_rcc", "sp", [-1, 1]], ["tile_ry", "sp", [-1, 3]], ["tile_rx", "sp", [-1, 3]], ["auto_unroll_max_step", "ot", 1500], ["unroll_explicit", "ot", 0]]}, "result": [[3.0720000000000004e-05, 3.0784e-05, 3.0976e-05, 3.104e-05, 3.104e-05, 3.1104e-05, 3.1232e-05, 3.1424e-05], 0, 3.840351104736328, 1675925551.46529], "version": 0.2, "tvm_version": "0.11.dev0"}
{"input": ["opencl -keys=adreno,opencl,gpu -device=adreno -max_num_threads=256 -texture_spatial_limit=16384 -thread_warp_size=1", "conv2d_nhwc.image2d", [["TENSOR", [1, 28, 28, 1], "float32"], ["TENSOR", [3, 3, 1, 64], "float32"], [1, 1], [0, 0, 0, 0], [1, 1], "float32"], {}], "config": {"index": 1191, "code_hash": null, "entity": [["tile_fc", "sp", [-1, 2, 2]], ["tile_y", "sp", [-1, 1, 4]], ["tile_x", "sp", [-1, 7, 4]], ["tile_rcc", "sp", [-1, 1]], ["tile_ry", "sp", [-1, 1]], ["tile_rx", "sp", [-1, 1]], ["auto_unroll_max_step", "ot", 0], ["unroll_explicit", "ot", 0]]}, "result": [[4.7424e-05, 4.7551999999999995e-05, 4.8256e-05, 4.8256e-05, 4.8384e-05, 4.8448e-05, 4.8704e-05, 4.8768e-05], 0, 4.668699264526367, 1675925552.119296], "version": 0.2, "tvm_version": "0.11.dev0"}
{"input": ["opencl -keys=adreno,opencl,gpu -device=adreno -max_num_threads=256 -texture_spatial_limit=16384 -thread_warp_size=1", "conv2d_nhwc.image2d", [["TENSOR", [1, 28, 28, 1], "float32"], ["TENSOR", [3, 3, 1, 64], "float32"], [1, 1], [0, 0, 0, 0], [1, 1], "float32"], {}], "config": {"index": 39939, "code_hash": null, "entity": [["tile_fc", "sp", [-1, 1, 16]], ["tile_y", "sp", [-1, 7, 1]], ["tile_x", "sp", [-1, 2, 2]], ["tile_rcc", "sp", [-1, 1]], ["tile_ry", "sp", [-1, 1]], ["tile_rx", "sp", [-1, 1]], ["auto_unroll_max_step", "ot", 1500], ["unroll_explicit", "ot", 1]]}, "result": [[0.000107008, 0.000107968, 0.000108224, 0.00010847999999999999, 0.000108736, 0.000108864, 0.000108992, 0.000109504], 0, 8.269755125045776, 1675925553.423307], "version": 0.2, "tvm_version": "0.11.dev0"}
{"input": ["opencl -keys=adreno,opencl,gpu -device=adreno -max_num_threads=256 -texture_spatial_limit=16384 -thread_warp_size=1", "conv2d_nhwc.image2d", [["TENSOR", [1, 28, 28, 1], "float32"], ["TENSOR", [3, 3, 1, 64], "float32"], [1, 1], [0, 0, 0, 0], [1, 1], "float32"], {}], "config": {"index": 30109, "code_hash": null, "entity": [["tile_fc", "sp", [-1, 1, 16]], ["tile_y", "sp", [-1, 1, 1]], ["tile_x", "sp", [-1, 2, 2]], ["tile_rcc", "sp", [-1, 1]], ["tile_ry", "sp", [-1, 3]], ["tile_rx", "sp", [-1, 3]], ["auto_unroll_max_step", "ot", 0], ["unroll_explicit", "ot", 1]]}, "result": [[7.5776e-05, 7.5904e-05, 7.596799999999999e-05, 7.596799999999999e-05, 7.6032e-05, 7.6288e-05, 7.6288e-05, 7.6672e-05], 0, 4.681215047836304, 1675925552.423069], "version": 0.2, "tvm_version": "0.11.dev0"}
{"input": ["opencl -keys=adreno,opencl,gpu -device=adreno -max_num_threads=256 -texture_spatial_limit=16384 -thread_warp_size=1", "conv2d_nhwc.image2d", [["TENSOR", [1, 28, 28, 1], "float32"], ["TENSOR", [3, 3, 1, 64], "float32"], [1, 1], [0, 0, 0, 0], [1, 1], "float32"], {}], "config": {"index": 39177, "code_hash": null, "entity": [["tile_fc", "sp", [-1, 1, 8]], ["tile_y", "sp", [-1, 4, 7]], ["tile_x", "sp", [-1, 2, 14]], ["tile_rcc", "sp", [-1, 1]], ["tile_ry", "sp", [-1, 3]], ["tile_rx", "sp", [-1, 3]], ["auto_unroll_max_step", "ot", 512], ["unroll_explicit", "ot", 1]]}, "result": [[0.00018784000000000002, 0.000189504, 0.00018976, 0.00018995200000000001, 0.00019020799999999998, 0.00019027199999999998, 0.00019104, 0.00019142400000000002], 0, 6.754009008407593, 1675925552.8792388], "version": 0.2, "tvm_version": "0.11.dev0"}
{"input": ["opencl -keys=adreno,opencl,gpu -device=adreno -max_num_threads=256 -texture_spatial_limit=16384 -thread_warp_size=1", "conv2d_nhwc.image2d", [["TENSOR", [1, 28, 28, 1], "float32"], ["TENSOR", [3, 3, 1, 64], "float32"], [1, 1], [0, 0, 0, 0], [1, 1], "float32"], {}], "config": {"index": 3575, "code_hash": null, "entity": [["tile_fc", "sp", [-1, 2, 4]], ["tile_y", "sp", [-1, 1, 4]], ["tile_x", "sp", [-1, 4, 7]], ["tile_rcc", "sp", [-1, 1]], ["tile_ry", "sp", [-1, 3]], ["tile_rx", "sp", [-1, 1]], ["auto_unroll_max_step", "ot", 0], ["unroll_explicit", "ot", 0]]}, "result": [[3.9424e-05, 3.9488000000000005e-05, 3.9744000000000004e-05, 3.9744000000000004e-05, 3.9936e-05, 3.9936e-05, 3.9936e-05, 4.0256e-05], 0, 0.963759183883667, 1675925558.659892], "version": 0.2, "tvm_version": "0.11.dev0"}
{"input": ["opencl -keys=adreno,opencl,gpu -device=adreno -max_num_threads=256 -texture_spatial_limit=16384 -thread_warp_size=1", "conv2d_nhwc.image2d", [["TENSOR", [1, 28, 28, 1], "float32"], ["TENSOR", [3, 3, 1, 64], "float32"], [1, 1], [0, 0, 0, 0], [1, 1], "float32"], {}], "config": {"index": 26129, "code_hash": null, "entity": [["tile_fc", "sp", [-1, 1, 16]], ["tile_y", "sp", [-1, 7, 4]], ["tile_x", "sp", [-1, 1, 2]], ["tile_rcc", "sp", [-1, 1]], ["tile_ry", "sp", [-1, 3]], ["tile_rx", "sp", [-1, 1]], ["auto_unroll_max_step", "ot", 0], ["unroll_explicit", "ot", 1]]}, "result": [[2.8288e-05, 2.848e-05, 2.8736e-05, 2.8736e-05, 2.8736e-05, 2.88e-05, 2.88e-05, 2.88e-05], 0, 1.7385249137878418, 1675925559.263319], "version": 0.2, "tvm_version": "0.11.dev0"}
{"input": ["opencl -keys=adreno,opencl,gpu -device=adreno -max_num_threads=256 -texture_spatial_limit=16384 -thread_warp_size=1", "conv2d_nhwc.image2d", [["TENSOR", [1, 28, 28, 1], "float32"], ["TENSOR", [3, 3, 1, 64], "float32"], [1, 1], [0, 0, 0, 0], [1, 1], "float32"], {}], "config": {"index": 19207, "code_hash": null, "entity": [["tile_fc", "sp", [-1, 1, 8]], ["tile_y", "sp", [-1, 4, 1]], ["tile_x", "sp", [-1, 4, 7]], ["tile_rcc", "sp", [-1, 1]], ["tile_ry", "sp", [-1, 3]], ["tile_rx", "sp", [-1, 1]], ["auto_unroll_max_step", "ot", 1500], ["unroll_explicit", "ot", 0]]}, "result": [[6.5472e-05, 6.5472e-05, 6.5472e-05, 6.553599999999999e-05, 6.572799999999999e-05, 6.572799999999999e-05, 6.579200000000001e-05, 6.592e-05], 0, 2.007289171218872, 1675925559.5847812], "version": 0.2, "tvm_version": "0.11.dev0"}
{"input": ["opencl -keys=adreno,opencl,gpu -device=adreno -max_num_threads=256 -texture_spatial_limit=16384 -thread_warp_size=1", "conv2d_nhwc.image2d", [["TENSOR", [1, 28, 28, 1], "float32"], ["TENSOR", [3, 3, 1, 64], "float32"], [1, 1], [0, 0, 0, 0], [1, 1], "float32"], {}], "config": {"index": 1890, "code_hash": null, "entity": [["tile_fc", "sp", [-1, 1, 2]], ["tile_y", "sp", [-1, 1, 4]], ["tile_x", "sp", [-1, 2, 14]], ["tile_rcc", "sp", [-1, 1]], ["tile_ry", "sp", [-1, 1]], ["tile_rx", "sp", [-1, 1]], ["auto_unroll_max_step", "ot", 0], ["unroll_explicit", "ot", 0]]}, "result": [[7.072e-05, 7.1744e-05, 7.1936e-05, 7.199999999999999e-05, 7.2192e-05, 7.225600000000001e-05, 7.2832e-05, 7.347199999999999e-05], 0, 1.0653471946716309, 1675925558.956336], "version": 0.2, "tvm_version": "0.11.dev0"}
{"input": ["opencl -keys=adreno,opencl,gpu -device=adreno -max_num_threads=256 -texture_spatial_limit=16384 -thread_warp_size=1", "conv2d_nhwc.image2d", [["TENSOR", [1, 28, 28, 1], "float32"], ["TENSOR", [3, 3, 1, 64], "float32"], [1, 1], [0, 0, 0, 0], [1, 1], "float32"], {}], "config": {"index": 7411, "code_hash": null, "entity": [["tile_fc", "sp", [-1, 2, 2]], ["tile_y", "sp", [-1, 2, 14]], ["tile_x", "sp", [-1, 2, 7]], ["tile_rcc", "sp", [-1, 1]], ["tile_ry", "sp", [-1, 3]], ["tile_rx", "sp", [-1, 3]], ["auto_unroll_max_step", "ot", 0], ["unroll_explicit", "ot", 0]]}, "result": [[5.5296e-05, 5.5488e-05, 5.5744e-05, 5.6256e-05, 5.7728e-05, 5.7792000000000005e-05, 5.824e-05, 6.08e-05], 0, 3.7182841300964355, 1675925561.407966], "version": 0.2, "tvm_version": "0.11.dev0"}
{"input": ["opencl -keys=adreno,opencl,gpu -device=adreno -max_num_threads=256 -texture_spatial_limit=16384 -thread_warp_size=1", "conv2d_nhwc.image2d", [["TENSOR", [1, 28, 28, 1], "float32"], ["TENSOR", [3, 3, 1, 64], "float32"], [1, 1], [0, 0, 0, 0], [1, 1], "float32"], {}], "config": {"index": 14821, "code_hash": null, "entity": [["tile_fc", "sp", [-1, 2, 2]], ["tile_y", "sp", [-1, 1, 14]], ["tile_x", "sp", [-1, 1, 4]], ["tile_rcc", "sp", [-1, 1]], ["tile_ry", "sp", [-1, 3]], ["tile_rx", "sp", [-1, 3]], ["auto_unroll_max_step", "ot", 512], ["unroll_explicit", "ot", 0]]}, "result": [[6.0544e-05, 6.0544e-05, 6.0735999999999996e-05, 6.08e-05, 6.1248e-05, 6.1312e-05, 6.1568e-05, 6.1696e-05], 0, 2.005197048187256, 1675925559.87868], "version": 0.2, "tvm_version": "0.11.dev0"}
{"input": ["opencl -keys=adreno,opencl,gpu -device=adreno -max_num_threads=256 -texture_spatial_limit=16384 -thread_warp_size=1", "conv2d_nhwc.image2d", [["TENSOR", [1, 28, 28, 1], "float32"], ["TENSOR", [3, 3, 1, 64], "float32"], [1, 1], [0, 0, 0, 0], [1, 1], "float32"], {}], "config": {"index": 19707, "code_hash": null, "entity": [["tile_fc", "sp", [-1, 1, 8]], ["tile_y", "sp", [-1, 2, 7]], ["tile_x", "sp", [-1, 1, 1]], ["tile_rcc", "sp", [-1, 1]], ["tile_ry", "sp", [-1, 1]], ["tile_rx", "sp", [-1, 3]], ["auto_unroll_max_step", "ot", 1500], ["unroll_explicit", "ot", 0]]}, "result": [[4.6016e-05, 4.6080000000000006e-05, 4.6336000000000005e-05, 4.6528e-05, 4.672e-05, 4.6848e-05, 4.704e-05, 4.7104e-05], 0, 2.2770209312438965, 1675925560.190292], "version": 0.2, "tvm_version": "0.11.dev0"}
{"input": ["opencl -keys=adreno,opencl,gpu -device=adreno -max_num_threads=256 -texture_spatial_limit=16384 -thread_warp_size=1", "conv2d_nhwc.image2d", [["TENSOR", [1, 28, 28, 1], "float32"], ["TENSOR", [3, 3, 1, 64], "float32"], [1, 1], [0, 0, 0, 0], [1, 1], "float32"], {}], "config": {"index": 17624, "code_hash": null, "entity": [["tile_fc", "sp", [-1, 1, 4]], ["tile_y", "sp", [-1, 1, 14]], ["tile_x", "sp", [-1, 2, 14]], ["tile_rcc", "sp", [-1, 1]], ["tile_ry", "sp", [-1, 1]], ["tile_rx", "sp", [-1, 1]], ["auto_unroll_max_step", "ot", 1500], ["unroll_explicit", "ot", 0]]}, "result": [[9.068800000000001e-05, 9.1456e-05, 9.1712e-05, 9.1712e-05, 9.1776e-05, 9.2032e-05, 9.3376e-05, 9.344e-05], 0, 2.6009068489074707, 1675925560.487099], "version": 0.2, "tvm_version": "0.11.dev0"}
{"input": ["opencl -keys=adreno,opencl,gpu -device=adreno -max_num_threads=256 -texture_spatial_limit=16384 -thread_warp_size=1", "conv2d_nhwc.image2d", [["TENSOR", [1, 28, 28, 1], "float32"], ["TENSOR", [3, 3, 1, 64], "float32"], [1, 1], [0, 0, 0, 0], [1, 1], "float32"], {}], "config": {"index": 38825, "code_hash": null, "entity": [["tile_fc", "sp", [-1, 2, 4]], ["tile_y", "sp", [-1, 1, 2]], ["tile_x", "sp", [-1, 4, 7]], ["tile_rcc", "sp", [-1, 1]], ["tile_ry", "sp", [-1, 3]], ["tile_rx", "sp", [-1, 3]], ["auto_unroll_max_step", "ot", 512], ["unroll_explicit", "ot", 1]]}, "result": [[5.7728e-05, 5.7792000000000005e-05, 5.7984e-05, 5.8304e-05, 5.8304e-05, 5.8688e-05, 5.8751999999999996e-05, 5.8816e-05], 0, 6.009898900985718, 1675925561.829984], "version": 0.2, "tvm_version": "0.11.dev0"}
{"input": ["opencl -keys=adreno,opencl,gpu -device=adreno -max_num_threads=256 -texture_spatial_limit=16384 -thread_warp_size=1", "conv2d_nhwc.image2d", [["TENSOR", [1, 28, 28, 1], "float32"], ["TENSOR", [3, 3, 1, 64], "float32"], [1, 1], [0, 0, 0, 0], [1, 1], "float32"], {}], "config": {"index": 46821, "code_hash": null, "entity": [["tile_fc", "sp", [-1, 2, 2]], ["tile_y", "sp", [-1, 7, 2]], ["tile_x", "sp", [-1, 1, 14]], ["tile_rcc", "sp", [-1, 1]], ["tile_ry", "sp", [-1, 3]], ["tile_rx", "sp", [-1, 3]], ["auto_unroll_max_step", "ot", 1500], ["unroll_explicit", "ot", 1]]}, "result": [[0.0006924160000000001, 0.000694464, 0.000700736, 0.000701504, 0.0007037440000000001, 0.0007037440000000001, 0.000704448, 0.000711616], 0, 7.33634877204895, 1675925561.0794618], "version": 0.2, "tvm_version": "0.11.dev0"}
{"input": ["opencl -keys=adreno,opencl,gpu -device=adreno -max_num_threads=256 -texture_spatial_limit=16384 -thread_warp_size=1", "conv2d_nhwc.image2d", [["TENSOR", [1, 28, 28, 1], "float32"], ["TENSOR", [3, 3, 1, 64], "float32"], [1, 1], [0, 0, 0, 0], [1, 1], "float32"], {}], "config": {"index": 4577, "code_hash": null, "entity": [["tile_fc", "sp", [-1, 1, 8]], ["tile_y", "sp", [-1, 1, 7]], ["tile_x", "sp", [-1, 1, 2]], ["tile_rcc", "sp", [-1, 1]], ["tile_ry", "sp", [-1, 1]], ["tile_rx", "sp", [-1, 3]], ["auto_unroll_max_step", "ot", 0], ["unroll_explicit", "ot", 0]]}, "result": [[4.672e-05, 4.704e-05, 4.704e-05, 4.7168e-05, 4.7232000000000005e-05, 4.7295999999999996e-05, 4.7424e-05, 4.7488000000000003e-05], 0, 4.481211185455322, 1675925562.425326], "version": 0.2, "tvm_version": "0.11.dev0"}
{"input": ["opencl -keys=adreno,opencl,gpu -device=adreno -max_num_threads=256 -texture_spatial_limit=16384 -thread_warp_size=1", "conv2d_nhwc.image2d", [["TENSOR", [1, 28, 28, 1], "float32"], ["TENSOR", [3, 3, 1, 64], "float32"], [1, 1], [0, 0, 0, 0], [1, 1], "float32"], {}], "config": {"index": 15586, "code_hash": null, "entity": [["tile_fc", "sp", [-1, 4, 4]], ["tile_y", "sp", [-1, 1, 2]], ["tile_x", "sp", [-1, 2, 14]], ["tile_rcc", "sp", [-1, 1]], ["tile_ry", "sp", [-1, 3]], ["tile_rx", "sp", [-1, 3]], ["auto_unroll_max_step", "ot", 512], ["unroll_explicit", "ot", 0]]}, "result": [[4.1216e-05, 4.1216e-05, 4.1216e-05, 4.1472e-05, 4.1856e-05, 4.1984e-05, 4.224e-05, 4.2368000000000005e-05], 0, 4.4062278270721436, 1675925562.148005], "version": 0.2, "tvm_version": "0.11.dev0"}
{"input": ["opencl -keys=adreno,opencl,gpu -device=adreno -max_num_threads=256 -texture_spatial_limit=16384 -thread_warp_size=1", "conv2d_nhwc.image2d", [["TENSOR", [1, 28, 28, 1], "float32"], ["TENSOR", [3, 3, 1, 64], "float32"], [1, 1], [0, 0, 0, 0], [1, 1], "float32"], {}], "config": {"index": 34267, "code_hash": null, "entity": [["tile_fc", "sp", [-1, 1, 8]], ["tile_y", "sp", [-1, 2, 7]], ["tile_x", "sp", [-1, 7, 2]], ["tile_rcc", "sp", [-1, 1]], ["tile_ry", "sp", [-1, 3]], ["tile_rx", "sp", [-1, 1]], ["auto_unroll_max_step", "ot", 512], ["unroll_explicit", "ot", 1]]}, "result": [[0.000184704, 0.000186496, 0.000187968, 0.00018848, 0.000188672, 0.00018995200000000001, 0.000190464, 0.00019180800000000002], 0, 9.42654275894165, 1675925563.017139], "version": 0.2, "tvm_version": "0.11.dev0"}
{"input": ["opencl -keys=adreno,opencl,gpu -device=adreno -max_num_threads=256 -texture_spatial_limit=16384 -thread_warp_size=1", "conv2d_nhwc.image2d", [["TENSOR", [1, 28, 28, 1], "float32"], ["TENSOR", [3, 3, 1, 64], "float32"], [1, 1], [0, 0, 0, 0], [1, 1], "float32"], {}], "config": {"index": 37875, "code_hash": null, "entity": [["tile_fc", "sp", [-1, 2, 4]], ["tile_y", "sp", [-1, 1, 4]], ["tile_x", "sp", [-1, 1, 2]], ["tile_rcc", "sp", [-1, 1]], ["tile_ry", "sp", [-1, 3]], ["tile_rx", "sp", [-1, 3]], ["auto_unroll_max_step", "ot", 512], ["unroll_explicit", "ot", 1]]}, "result": [[5.3696e-05, 5.376e-05, 5.376e-05, 5.376e-05, 5.3824e-05, 5.3952e-05, 5.3952e-05, 5.3952e-05], 0, 6.117667198181152, 1675925563.35275], "version": 0.2, "tvm_version": "0.11.dev0"}
{"input": ["opencl -keys=adreno,opencl,gpu -device=adreno -max_num_threads=256 -texture_spatial_limit=16384 -thread_warp_size=1", "conv2d_nhwc.image2d", [["TENSOR", [1, 28, 28, 1], "float32"], ["TENSOR", [3, 3, 1, 64], "float32"], [1, 1], [0, 0, 0, 0], [1, 1], "float32"], {}], "config": {"index": 13609, "code_hash": null, "entity": [["tile_fc", "sp", [-1, 1, 16]], ["tile_y", "sp", [-1, 4, 1]], ["tile_x", "sp", [-1, 2, 14]], ["tile_rcc", "sp", [-1, 1]], ["tile_ry", "sp", [-1, 1]], ["tile_rx", "sp", [-1, 3]], ["auto_unroll_max_step", "ot", 512], ["unroll_explicit", "ot", 0]]}, "result": [[3.1616e-05, 3.1744e-05, 3.1744e-05, 3.1744e-05, 3.1936e-05, 3.1936e-05, 3.1936e-05, 3.2e-05], 0, 5.892352104187012, 1675925563.683166], "version": 0.2, "tvm_version": "0.11.dev0"}
{"input": ["opencl -keys=adreno,opencl,gpu -device=adreno -max_num_threads=256 -texture_spatial_limit=16384 -thread_warp_size=1", "conv2d_nhwc.image2d", [["TENSOR", [1, 28, 28, 1], "float32"], ["TENSOR", [3, 3, 1, 64], "float32"], [1, 1], [0, 0, 0, 0], [1, 1], "float32"], {}], "config": {"index": 32720, "code_hash": null, "entity": [["tile_fc", "sp", [-1, 1, 2]], ["tile_y", "sp", [-1, 2, 7]], ["tile_x", "sp", [-1, 1, 7]], ["tile_rcc", "sp", [-1, 1]], ["tile_ry", "sp", [-1, 1]], ["tile_rx", "sp", [-1, 1]], ["auto_unroll_max_step", "ot", 512], ["unroll_explicit", "ot", 1]]}, "result": [[7.878400000000001e-05, 7.904e-05, 7.9232e-05, 7.9744e-05, 7.993599999999999e-05, 8.0576e-05, 8.076800000000001e-05, 8.096000000000001e-05], 0, 1.3703718185424805, 1675925565.921398], "version": 0.2, "tvm_version": "0.11.dev0"}
{"input": ["opencl -keys=adreno,opencl,gpu -device=adreno -max_num_threads=256 -texture_spatial_limit=16384 -thread_warp_size=1", "conv2d_nhwc.image2d", [["TENSOR", [1, 28, 28, 1], "float32"], ["TENSOR", [3, 3, 1, 64], "float32"], [1, 1], [0, 0, 0, 0], [1, 1], "float32"], {}], "config": {"index": 25020, "code_hash": null, "entity": [["tile_fc", "sp", [-1, 1, 2]], ["tile_y", "sp", [-1, 2, 7]], ["tile_x", "sp", [-1, 2, 7]], ["tile_rcc", "sp", [-1, 1]], ["tile_ry", "sp", [-1, 1]], ["tile_rx", "sp", [-1, 1]], ["auto_unroll_max_step", "ot", 0], ["unroll_explicit", "ot", 1]]}, "result": [[7.750400000000001e-05, 7.7568e-05, 7.7696e-05, 7.7696e-05, 7.7824e-05, 7.795199999999999e-05, 7.8336e-05, 7.871999999999999e-05], 0, 2.3356451988220215, 1675925567.284327], "version": 0.2, "tvm_version": "0.11.dev0"}
{"input": ["opencl -keys=adreno,opencl,gpu -device=adreno -max_num_threads=256 -texture_spatial_limit=16384 -thread_warp_size=1", "conv2d_nhwc.image2d", [["TENSOR", [1, 28, 28, 1], "float32"], ["TENSOR", [3, 3, 1, 64], "float32"], [1, 1], [0, 0, 0, 0], [1, 1], "float32"], {}], "config": {"index": 8654, "code_hash": null, "entity": [["tile_fc", "sp", [-1, 1, 4]], ["tile_y", "sp", [-1, 4, 7]], ["tile_x", "sp", [-1, 2, 2]], ["tile_rcc", "sp", [-1, 1]], ["tile_ry", "sp", [-1, 1]], ["tile_rx", "sp", [-1, 1]], ["auto_unroll_max_step", "ot", 512], ["unroll_explicit", "ot", 0]]}, "result": [[3.3216e-05, 3.328e-05, 3.328e-05, 3.3344e-05, 3.3472e-05, 3.3728e-05, 3.3984e-05, 3.4176e-05], 0, 1.54050612449646, 1675925566.589874], "version": 0.2, "tvm_version": "0.11.dev0"}
{"input": ["opencl -keys=adreno,opencl,gpu -device=adreno -max_num_threads=256 -texture_spatial_limit=16384 -thread_warp_size=1", "conv2d_nhwc.image2d", [["TENSOR", [1, 28, 28, 1], "float32"], ["TENSOR", [3, 3, 1, 64], "float32"], [1, 1], [0, 0, 0, 0], [1, 1], "float32"], {}], "config": {"index": 35018, "code_hash": null, "entity": [["tile_fc", "sp", [-1, 2, 8]], ["tile_y", "sp", [-1, 2, 1]], ["tile_x", "sp", [-1, 1, 14]], ["tile_rcc", "sp", [-1, 1]], ["tile_ry", "sp", [-1, 3]], ["tile_rx", "sp", [-1, 1]], ["auto_unroll_max_step", "ot", 512], ["unroll_explicit", "ot", 1]]}, "result": [[3.0208e-05, 3.0208e-05, 3.0208e-05, 3.0464000000000002e-05, 3.0464000000000002e-05, 3.0464000000000002e-05, 3.0527999999999996e-05, 3.0784e-05], 0, 1.850165843963623, 1675925566.272702], "version": 0.2, "tvm_version": "0.11.dev0"}
{"input": ["opencl -keys=adreno,opencl,gpu -device=adreno -max_num_threads=256 -texture_spatial_limit=16384 -thread_warp_size=1", "conv2d_nhwc.image2d", [["TENSOR", [1, 28, 28, 1], "float32"], ["TENSOR", [3, 3, 1, 64], "float32"], [1, 1], [0, 0, 0, 0], [1, 1], "float32"], {}], "config": {"index": 2086, "code_hash": null, "entity": [["tile_fc", "sp", [-1, 4, 4]], ["tile_y", "sp", [-1, 1, 14]], ["tile_x", "sp", [-1, 1, 1]], ["tile_rcc", "sp", [-1, 1]], ["tile_ry", "sp", [-1, 3]], ["tile_rx", "sp", [-1, 1]], ["auto_unroll_max_step", "ot", 0], ["unroll_explicit", "ot", 0]]}, "result": [[7.424e-05, 7.4368e-05, 7.4432e-05, 7.4432e-05, 7.449600000000001e-05, 7.500800000000001e-05, 7.500800000000001e-05, 7.52e-05], 0, 5.004559755325317, 1675925570.226496], "version": 0.2, "tvm_version": "0.11.dev0"}
{"input": ["opencl -keys=adreno,opencl,gpu -device=adreno -max_num_threads=256 -texture_spatial_limit=16384 -thread_warp_size=1", "conv2d_nhwc.image2d", [["TENSOR", [1, 28, 28, 1], "float32"], ["TENSOR", [3, 3, 1, 64], "float32"], [1, 1], [0, 0, 0, 0], [1, 1], "float32"], {}], "config": {"index": 37658, "code_hash": null, "entity": [["tile_fc", "sp", [-1, 2, 8]], ["tile_y", "sp", [-1, 2, 14]], ["tile_x", "sp", [-1, 4, 1]], ["tile_rcc", "sp", [-1, 1]], ["tile_ry", "sp", [-1, 3]], ["tile_rx", "sp", [-1, 3]], ["auto_unroll_max_step", "ot", 512], ["unroll_explicit", "ot", 1]]}, "result": [[5.8944000000000003e-05, 5.9007999999999995e-05, 5.9007999999999995e-05, 5.92e-05, 5.92e-05, 5.9648e-05, 5.9712e-05, 5.9712e-05], 0, 3.131531000137329, 1675925566.959965], "version": 0.2, "tvm_version": "0.11.dev0"}
{"input": ["opencl -keys=adreno,opencl,gpu -device=adreno -max_num_threads=256 -texture_spatial_limit=16384 -thread_warp_size=1", "conv2d_nhwc.image2d", [["TENSOR", [1, 28, 28, 1], "float32"], ["TENSOR", [3, 3, 1, 64], "float32"], [1, 1], [0, 0, 0, 0], [1, 1], "float32"], {}], "config": {"index": 10474, "code_hash": null, "entity": [["tile_fc", "sp", [-1, 1, 4]], ["tile_y", "sp", [-1, 4, 7]], ["tile_x", "sp", [-1, 1, 2]], ["tile_rcc", "sp", [-1, 1]], ["tile_ry", "sp", [-1, 3]], ["tile_rx", "sp", [-1, 1]], ["auto_unroll_max_step", "ot", 512], ["unroll_explicit", "ot", 0]]}, "result": [[3.7248000000000007e-05, 3.744e-05, 3.7696e-05, 3.7760000000000004e-05, 3.7760000000000004e-05, 3.8016e-05, 3.808e-05, 3.8719999999999995e-05], 0, 2.452942132949829, 1675925567.620855], "version": 0.2, "tvm_version": "0.11.dev0"}
{"input": ["opencl -keys=adreno,opencl,gpu -device=adreno -max_num_threads=256 -texture_spatial_limit=16384 -thread_warp_size=1", "conv2d_nhwc.image2d", [["TENSOR", [1, 28, 28, 1], "float32"], ["TENSOR", [3, 3, 1, 64], "float32"], [1, 1], [0, 0, 0, 0], [1, 1], "float32"], {}], "config": {"index": 11710, "code_hash": null, "entity": [["tile_fc", "sp", [-1, 1, 2]], ["tile_y", "sp", [-1, 1, 7]], ["tile_x", "sp", [-1, 2, 14]], ["tile_rcc", "sp", [-1, 1]], ["tile_ry", "sp", [-1, 3]], ["tile_rx", "sp", [-1, 1]], ["auto_unroll_max_step", "ot", 512], ["unroll_explicit", "ot", 0]]}, "result": [[9.0944e-05, 9.0944e-05, 9.2736e-05, 9.299200000000001e-05, 9.3248e-05, 9.3312e-05, 9.472e-05, 9.497600000000001e-05], 0, 2.6832759380340576, 1675925567.925678], "version": 0.2, "tvm_version": "0.11.dev0"}
{"input": ["opencl -keys=adreno,opencl,gpu -device=adreno -max_num_threads=256 -texture_spatial_limit=16384 -thread_warp_size=1", "conv2d_nhwc.image2d", [["TENSOR", [1, 28, 28, 1], "float32"], ["TENSOR", [3, 3, 1, 64], "float32"], [1, 1], [0, 0, 0, 0], [1, 1], "float32"], {}], "config": {"index": 26009, "code_hash": null, "entity": [["tile_fc", "sp", [-1, 1, 16]], ["tile_y", "sp", [-1, 2, 7]], ["tile_x", "sp", [-1, 7, 1]], ["tile_rcc", "sp", [-1, 1]], ["tile_ry", "sp", [-1, 3]], ["tile_rx", "sp", [-1, 1]], ["auto_unroll_max_step", "ot", 0], ["unroll_explicit", "ot", 1]]}, "result": [[4.48e-05, 4.4928e-05, 4.4928e-05, 4.4992e-05, 4.4992e-05, 4.4992e-05, 4.4992e-05, 4.4992e-05], 0, 3.732445001602173, 1675925568.2652779], "version": 0.2, "tvm_version": "0.11.dev0"}
{"input": ["opencl -keys=adreno,opencl,gpu -device=adreno -max_num_threads=256 -texture_spatial_limit=16384 -thread_warp_size=1", "conv2d_nhwc.image2d", [["TENSOR", [1, 28, 28, 1], "float32"], ["TENSOR", [3, 3, 1, 64], "float32"], [1, 1], [0, 0, 0, 0], [1, 1], "float32"], {}], "config": {"index": 787, "code_hash": null, "entity": [["tile_fc", "sp", [-1, 1, 8]], ["tile_y", "sp", [-1, 7, 4]], ["tile_x", "sp", [-1, 2, 2]], ["tile_rcc", "sp", [-1, 1]], ["tile_ry", "sp", [-1, 1]], ["tile_rx", "sp", [-1, 1]], ["auto_unroll_max_step", "ot", 0], ["unroll_explicit", "ot", 0]]}, "result": [[6.1312e-05, 6.144000000000001e-05, 6.1504e-05, 6.1504e-05, 6.176e-05, 6.176e-05, 6.2016e-05, 6.2272e-05], 0, 5.640370845794678, 1675925570.534505], "version": 0.2, "tvm_version": "0.11.dev0"}
{"input": ["opencl -keys=adreno,opencl,gpu -device=adreno -max_num_threads=256 -texture_spatial_limit=16384 -thread_warp_size=1", "conv2d_nhwc.image2d", [["TENSOR", [1, 28, 28, 1], "float32"], ["TENSOR", [3, 3, 1, 64], "float32"], [1, 1], [0, 0, 0, 0], [1, 1], "float32"], {}], "config": {"index": 6941, "code_hash": null, "entity": [["tile_fc", "sp", [-1, 2, 2]], ["tile_y", "sp", [-1, 7, 4]], ["tile_x", "sp", [-1, 1, 4]], ["tile_rcc", "sp", [-1, 1]], ["tile_ry", "sp", [-1, 3]], ["tile_rx", "sp", [-1, 3]], ["auto_unroll_max_step", "ot", 0], ["unroll_explicit", "ot", 0]]}, "result": [[4.8320000000000005e-05, 4.8320000000000005e-05, 4.8448e-05, 4.8512e-05, 4.8512e-05, 4.8512e-05, 4.8768e-05, 4.9216000000000004e-05], 0, 3.6841230392456055, 1675925568.583788], "version": 0.2, "tvm_version": "0.11.dev0"}
{"input": ["opencl -keys=adreno,opencl,gpu -device=adreno -max_num_threads=256 -texture_spatial_limit=16384 -thread_warp_size=1", "conv2d_nhwc.image2d", [["TENSOR", [1, 28, 28, 1], "float32"], ["TENSOR", [3, 3, 1, 64], "float32"], [1, 1], [0, 0, 0, 0], [1, 1], "float32"], {}], "config": {"index": 44730, "code_hash": null, "entity": [["tile_fc", "sp", [-1, 1, 2]], ["tile_y", "sp", [-1, 1, 4]], ["tile_x", "sp", [-1, 4, 7]], ["tile_rcc", "sp", [-1, 1]], ["tile_ry", "sp", [-1, 1]], ["tile_rx", "sp", [-1, 3]], ["auto_unroll_max_step", "ot", 1500], ["unroll_explicit", "ot", 1]]}, "result": [[6.579200000000001e-05, 6.5984e-05, 6.630400000000001e-05, 6.72e-05, 6.72e-05, 6.7264e-05, 6.7328e-05, 6.751999999999999e-05], 0, 4.736609220504761, 1675925568.945295], "version": 0.2, "tvm_version": "0.11.dev0"}
{"input": ["opencl -keys=adreno,opencl,gpu -device=adreno -max_num_threads=256 -texture_spatial_limit=16384 -thread_warp_size=1", "conv2d_nhwc.image2d", [["TENSOR", [1, 28, 28, 1], "float32"], ["TENSOR", [3, 3, 1, 64], "float32"], [1, 1], [0, 0, 0, 0], [1, 1], "float32"], {}], "config": {"index": 7254, "code_hash": null, "entity": [["tile_fc", "sp", [-1, 1, 4]], ["tile_y", "sp", [-1, 4, 7]], ["tile_x", "sp", [-1, 1, 7]], ["tile_rcc", "sp", [-1, 1]], ["tile_ry", "sp", [-1, 3]], ["tile_rx", "sp", [-1, 3]], ["auto_unroll_max_step", "ot", 0], ["unroll_explicit", "ot", 0]]}, "result": [[7.1168e-05, 7.1616e-05, 7.225600000000001e-05, 7.328e-05, 7.334400000000001e-05, 7.347199999999999e-05, 7.353600000000001e-05, 7.4688e-05], 0, 5.650297164916992, 1675925570.826914], "version": 0.2, "tvm_version": "0.11.dev0"}
{"input": ["opencl -keys=adreno,opencl,gpu -device=adreno -max_num_threads=256 -texture_spatial_limit=16384 -thread_warp_size=1", "conv2d_nhwc.image2d", [["TENSOR", [1, 28, 28, 1], "float32"], ["TENSOR", [3, 3, 1, 64], "float32"], [1, 1], [0, 0, 0, 0], [1, 1], "float32"], {}], "config": {"index": 40867, "code_hash": null, "entity": [["tile_fc", "sp", [-1, 1, 8]], ["tile_y", "sp", [-1, 1, 14]], ["tile_x", "sp", [-1, 4, 7]], ["tile_rcc", "sp", [-1, 1]], ["tile_ry", "sp", [-1, 1]], ["tile_rx", "sp", [-1, 1]], ["auto_unroll_max_step", "ot", 1500], ["unroll_explicit", "ot", 1]]}, "result": [[9.100800000000001e-05, 9.120000000000001e-05, 9.1264e-05, 9.1712e-05, 9.2224e-05, 9.2224e-05, 9.2224e-05, 9.2864e-05], 0, 5.405773162841797, 1675925569.613698], "version": 0.2, "tvm_version": "0.11.dev0"}
{"input": ["opencl -keys=adreno,opencl,gpu -device=adreno -max_num_threads=256 -texture_spatial_limit=16384 -thread_warp_size=1", "conv2d_nhwc.image2d", [["TENSOR", [1, 28, 28, 1], "float32"], ["TENSOR", [3, 3, 1, 64], "float32"], [1, 1], [0, 0, 0, 0], [1, 1], "float32"], {}], "config": {"index": 12427, "code_hash": null, "entity": [["tile_fc", "sp", [-1, 1, 8]], ["tile_y", "sp", [-1, 2, 7]], ["tile_x", "sp", [-1, 1, 2]], ["tile_rcc", "sp", [-1, 1]], ["tile_ry", "sp", [-1, 1]], ["tile_rx", "sp", [-1, 3]], ["auto_unroll_max_step", "ot", 512], ["unroll_explicit", "ot", 0]]}, "result": [[3.9296e-05, 3.9552e-05, 3.9616e-05, 3.968e-05, 3.9744000000000004e-05, 3.9936e-05, 4e-05, 4.0192e-05], 0, 4.018583297729492, 1675925569.254257], "version": 0.2, "tvm_version": "0.11.dev0"}
{"input": ["opencl -keys=adreno,opencl,gpu -device=adreno -max_num_threads=256 -texture_spatial_limit=16384 -thread_warp_size=1", "conv2d_nhwc.image2d", [["TENSOR", [1, 28, 28, 1], "float32"], ["TENSOR", [3, 3, 1, 64], "float32"], [1, 1], [0, 0, 0, 0], [1, 1], "float32"], {}], "config": {"index": 21500, "code_hash": null, "entity": [["tile_fc", "sp", [-1, 1, 2]], ["tile_y", "sp", [-1, 7, 4]], ["tile_x", "sp", [-1, 2, 14]], ["tile_rcc", "sp", [-1, 1]], ["tile_ry", "sp", [-1, 1]], ["tile_rx", "sp", [-1, 3]], ["auto_unroll_max_step", "ot", 1500], ["unroll_explicit", "ot", 0]]}, "result": [[8.896e-05, 8.921600000000001e-05, 8.992e-05, 8.9984e-05, 9.0112e-05, 9.0304e-05, 9.0944e-05, 9.3696e-05], 0, 4.967717170715332, 1675925569.929922], "version": 0.2, "tvm_version": "0.11.dev0"}
{"input": ["opencl -keys=adreno,opencl,gpu -device=adreno -max_num_threads=256 -texture_spatial_limit=16384 -thread_warp_size=1", "conv2d_nhwc_winograd.image2d", [["TENSOR", [1, 28, 28, 1], "float32"], ["TENSOR", [3, 3, 1, 64], "float32"], [1, 1], [0, 0, 0, 0], [1, 1], "float32"], {}], "config": {"index": 175, "code_hash": null, "entity": [["auto_unroll_max_step", "ot", 4], ["tile_y", "sp", [-1, 2, 8]], ["tile_x", "sp", [-1, 13, 13]], ["tile_rc", "sp", [-1, 1]]]}, "result": [[6.969599999999999e-05, 7.0208e-05, 7.027200000000001e-05, 7.104000000000001e-05, 7.2576e-05, 7.264e-05, 7.2768e-05, 7.3216e-05], 0, 10.508137226104736, 1675926441.4631062], "version": 0.2, "tvm_version": "0.11.dev0"}
{"input": ["opencl -keys=adreno,opencl,gpu -device=adreno -max_num_threads=256 -texture_spatial_limit=16384 -thread_warp_size=1", "conv2d_nhwc_winograd.image2d", [["TENSOR", [1, 28, 28, 1], "float32"], ["TENSOR", [3, 3, 1, 64], "float32"], [1, 1], [0, 0, 0, 0], [1, 1], "float32"], {}], "config": {"index": 162, "code_hash": null, "entity": [["auto_unroll_max_step", "ot", 0], ["tile_y", "sp", [-1, 1, 4]], ["tile_x", "sp", [-1, 13, 13]], ["tile_rc", "sp", [-1, 1]]]}, "result": [[7.7184e-05, 7.871999999999999e-05, 7.871999999999999e-05, 7.936e-05, 7.9552e-05, 7.9808e-05, 7.9872e-05, 8.096000000000001e-05], 0, 11.141434907913208, 1675926442.096073], "version": 0.2, "tvm_version": "0.11.dev0"}
{"input": ["opencl -keys=adreno,opencl,gpu -device=adreno -max_num_threads=256 -texture_spatial_limit=16384 -thread_warp_size=1", "conv2d_nhwc_winograd.image2d", [["TENSOR", [1, 28, 28, 1], "float32"], ["TENSOR", [3, 3, 1, 64], "float32"], [1, 1], [0, 0, 0, 0], [1, 1], "float32"], {}], "config": {"index": 130, "code_hash": null, "entity": [["auto_unroll_max_step", "ot", 4], ["tile_y", "sp", [-1, 2, 8]], ["tile_x", "sp", [-1, 1, 13]], ["tile_rc", "sp", [-1, 1]]]}, "result": [[7.8464e-05, 7.929600000000001e-05, 7.9552e-05, 7.968e-05, 8.0384e-05, 8.128000000000001e-05, 8.192e-05, 8.2048e-05], 0, 8.00001072883606, 1675926438.9578948], "version": 0.2, "tvm_version": "0.11.dev0"}
{"input": ["opencl -keys=adreno,opencl,gpu -device=adreno -max_num_threads=256 -texture_spatial_limit=16384 -thread_warp_size=1", "conv2d_nhwc_winograd.image2d", [["TENSOR", [1, 28, 28, 1], "float32"], ["TENSOR", [3, 3, 1, 64], "float32"], [1, 1], [0, 0, 0, 0], [1, 1], "float32"], {}], "config": {"index": 171, "code_hash": null, "entity": [["auto_unroll_max_step", "ot", 0], ["tile_y", "sp", [-1, 1, 8]], ["tile_x", "sp", [-1, 13, 13]], ["tile_rc", "sp", [-1, 1]]]}, "result": [[8.2496e-05, 8.3008e-05, 8.3712e-05, 8.3904e-05, 8.4032e-05, 8.4224e-05, 8.5504e-05, 8.723200000000001e-05], 0, 8.609095096588135, 1675926439.573096], "version": 0.2, "tvm_version": "0.11.dev0"}
{"input": ["opencl -keys=adreno,opencl,gpu -device=adreno -max_num_threads=256 -texture_spatial_limit=16384 -thread_warp_size=1", "conv2d_nhwc_winograd.image2d", [["TENSOR", [1, 28, 28, 1], "float32"], ["TENSOR", [3, 3, 1, 64], "float32"], [1, 1], [0, 0, 0, 0], [1, 1], "float32"], {}], "config": {"index": 172, "code_hash": null, "entity": [["auto_unroll_max_step", "ot", 4], ["tile_y", "sp", [-1, 1, 8]], ["tile_x", "sp", [-1, 13, 13]], ["tile_rc", "sp", [-1, 1]]]}, "result": [[7.0208e-05, 7.027200000000001e-05, 7.027200000000001e-05, 7.0656e-05, 7.2128e-05, 7.449600000000001e-05, 7.5264e-05, 7.584e-05], 0, 9.240816116333008, 1675926440.1953769], "version": 0.2, "tvm_version": "0.11.dev0"}
{"input": ["opencl -keys=adreno,opencl,gpu -device=adreno -max_num_threads=256 -texture_spatial_limit=16384 -thread_warp_size=1", "conv2d_nhwc_winograd.image2d", [["TENSOR", [1, 28, 28, 1], "float32"], ["TENSOR", [3, 3, 1, 64], "float32"], [1, 1], [0, 0, 0, 0], [1, 1], "float32"], {}], "config": {"index": 128, "code_hash": null, "entity": [["auto_unroll_max_step", "ot", 16], ["tile_y", "sp", [-1, 1, 8]], ["tile_x", "sp", [-1, 1, 13]], ["tile_rc", "sp", [-1, 1]]]}, "result": [[6.6752e-05, 6.6816e-05, 6.688e-05, 6.707200000000001e-05, 6.7392e-05, 6.7648e-05, 6.7648e-05, 6.8224e-05], 0, 7.3732099533081055, 1675926438.33024], "version": 0.2, "tvm_version": "0.11.dev0"}
{"input": ["opencl -keys=adreno,opencl,gpu -device=adreno -max_num_threads=256 -texture_spatial_limit=16384 -thread_warp_size=1", "conv2d_nhwc_winograd.image2d", [["TENSOR", [1, 28, 28, 1], "float32"], ["TENSOR", [3, 3, 1, 64], "float32"], [1, 1], [0, 0, 0, 0], [1, 1], "float32"], {}], "config": {"index": 166, "code_hash": null, "entity": [["auto_unroll_max_step", "ot", 4], ["tile_y", "sp", [-1, 2, 4]], ["tile_x", "sp", [-1, 13, 13]], ["tile_rc", "sp", [-1, 1]]]}, "result": [[7.5136e-05, 7.5712e-05, 7.584e-05, 7.6736e-05, 7.7632e-05, 7.8016e-05, 7.808e-05, 7.8144e-05], 0, 9.837676048278809, 1675926440.8219771], "version": 0.2, "tvm_version": "0.11.dev0"}
{"input": ["opencl -keys=adreno,opencl,gpu -device=adreno -max_num_threads=256 -texture_spatial_limit=16384 -thread_warp_size=1", "conv2d_nhwc_winograd.image2d", [["TENSOR", [1, 28, 28, 1], "float32"], ["TENSOR", [3, 3, 1, 64], "float32"], [1, 1], [0, 0, 0, 0], [1, 1], "float32"], {}], "config": {"index": 167, "code_hash": null, "entity": [["auto_unroll_max_step", "ot", 16], ["tile_y", "sp", [-1, 2, 4]], ["tile_x", "sp", [-1, 13, 13]], ["tile_rc", "sp", [-1, 1]]]}, "result": [[7.225600000000001e-05, 7.2512e-05, 7.302400000000001e-05, 7.3088e-05, 7.4048e-05, 7.4176e-05, 7.4624e-05, 7.596799999999999e-05], 0, 7.367503881454468, 1675926449.6543932], "version": 0.2, "tvm_version": "0.11.dev0"}
{"input": ["opencl -keys=adreno,opencl,gpu -device=adreno -max_num_threads=256 -texture_spatial_limit=16384 -thread_warp_size=1", "conv2d_nhwc_winograd.image2d", [["TENSOR", [1, 28, 28, 1], "float32"], ["TENSOR", [3, 3, 1, 64], "float32"], [1, 1], [0, 0, 0, 0], [1, 1], "float32"], {}], "config": {"index": 123, "code_hash": null, "entity": [["auto_unroll_max_step", "ot", 0], ["tile_y", "sp", [-1, 4, 4]], ["tile_x", "sp", [-1, 1, 13]], ["tile_rc", "sp", [-1, 1]]]}, "result": [[7.4816e-05, 7.500800000000001e-05, 7.532800000000001e-05, 7.6032e-05, 7.6544e-05, 7.8272e-05, 7.897600000000001e-05, 7.904e-05], 0, 7.748366117477417, 1675926450.263741], "version": 0.2, "tvm_version": "0.11.dev0"}
{"input": ["opencl -keys=adreno,opencl,gpu -device=adreno -max_num_threads=256 -texture_spatial_limit=16384 -thread_warp_size=1", "conv2d_nhwc_winograd.image2d", [["TENSOR", [1, 28, 28, 1], "float32"], ["TENSOR", [3, 3, 1, 64], "float32"], [1, 1], [0, 0, 0, 0], [1, 1], "float32"], {}], "config": {"index": 126, "code_hash": null, "entity": [["auto_unroll_max_step", "ot", 0], ["tile_y", "sp", [-1, 1, 8]], ["tile_x", "sp", [-1, 1, 13]], ["tile_rc", "sp", [-1, 1]]]}, "result": [[7.552000000000001e-05, 7.5712e-05, 7.5712e-05, 7.596799999999999e-05, 7.6352e-05, 7.6672e-05, 7.68e-05, 7.699200000000001e-05], 0, 8.968948602676392, 1675926451.4871428], "version": 0.2, "tvm_version": "0.11.dev0"}
{"input": ["opencl -keys=adreno,opencl,gpu -device=adreno -max_num_threads=256 -texture_spatial_limit=16384 -thread_warp_size=1", "conv2d_nhwc_winograd.image2d", [["TENSOR", [1, 28, 28, 1], "float32"], ["TENSOR", [3, 3, 1, 64], "float32"], [1, 1], [0, 0, 0, 0], [1, 1], "float32"], {}], "config": {"index": 168, "code_hash": null, "entity": [["auto_unroll_max_step", "ot", 0], ["tile_y", "sp", [-1, 4, 4]], ["tile_x", "sp", [-1, 13, 13]], ["tile_rc", "sp", [-1, 1]]]}, "result": [[0.001034432, 0.0011637759999999998, 0.0011766399999999998, 0.001200512, 0.001205376, 0.001206592, 0.00120864, 0.00121344], 0, 10.81362795829773, 1675926453.064637], "version": 0.2, "tvm_version": "0.11.dev0"}
{"input": ["opencl -keys=adreno,opencl,gpu -device=adreno -max_num_threads=256 -texture_spatial_limit=16384 -thread_warp_size=1", "conv2d_nhwc_winograd.image2d", [["TENSOR", [1, 28, 28, 1], "float32"], ["TENSOR", [3, 3, 1, 64], "float32"], [1, 1], [0, 0, 0, 0], [1, 1], "float32"], {}], "config": {"index": 176, "code_hash": null, "entity": [["auto_unroll_max_step", "ot", 16], ["tile_y", "sp", [-1, 2, 8]], ["tile_x", "sp", [-1, 13, 13]], ["tile_rc", "sp", [-1, 1]]]}, "result": [[6.9632e-05, 7.001599999999999e-05, 7.0208e-05, 7.0784e-05, 7.0912e-05, 7.148799999999999e-05, 7.2704e-05, 7.398399999999999e-05], 0, 8.39995813369751, 1675926450.882581], "version": 0.2, "tvm_version": "0.11.dev0"}
{"input": ["opencl -keys=adreno,opencl,gpu -device=adreno -max_num_threads=256 -texture_spatial_limit=16384 -thread_warp_size=1", "conv2d_nhwc_winograd.image2d", [["TENSOR", [1, 28, 28, 1], "float32"], ["TENSOR", [3, 3, 1, 64], "float32"], [1, 1], [0, 0, 0, 0], [1, 1], "float32"], {}], "config": {"index": 179, "code_hash": null, "entity": [["auto_unroll_max_step", "ot", 16], ["tile_y", "sp", [-1, 1, 16]], ["tile_x", "sp", [-1, 13, 13]], ["tile_rc", "sp", [-1, 1]]]}, "result": [[7.552000000000001e-05, 7.5584e-05, 7.584e-05, 7.6352e-05, 7.6416e-05, 7.699200000000001e-05, 7.7248e-05, 7.795199999999999e-05], 0, 11.183655738830566, 1675926453.7016242], "version": 0.2, "tvm_version": "0.11.dev0"}
{"input": ["opencl -keys=adreno,opencl,gpu -device=adreno -max_num_threads=256 -texture_spatial_limit=16384 -thread_warp_size=1", "conv2d_nhwc_winograd.image2d", [["TENSOR", [1, 28, 28, 1], "float32"], ["TENSOR", [3, 3, 1, 64], "float32"], [1, 1], [0, 0, 0, 0], [1, 1], "float32"], {}], "config": {"index": 170, "code_hash": null, "entity": [["auto_unroll_max_step", "ot", 16], ["tile_y", "sp", [-1, 4, 4]], ["tile_x", "sp", [-1, 13, 13]], ["tile_rc", "sp", [-1, 1]]]}, "result": [[0.001843456, 0.00184448, 0.0018478079999999998, 0.00184992, 0.001853952, 0.0018555520000000001, 0.001860672, 0.0018901760000000001], 0, 10.034708023071289, 1675926452.284972], "version": 0.2, "tvm_version": "0.11.dev0"}
{"input": ["opencl -keys=adreno,opencl,gpu -device=adreno -max_num_threads=256 -texture_spatial_limit=16384 -thread_warp_size=1", "conv2d_nhwc_winograd.image2d", [["TENSOR", [1, 28, 28, 1], "float32"], ["TENSOR", [3, 3, 1, 64], "float32"], [1, 1], [0, 0, 0, 0], [1, 1], "float32"], {}], "config": {"index": 173, "code_hash": null, "entity": [["auto_unroll_max_step", "ot", 16], ["tile_y", "sp", [-1, 1, 8]], ["tile_x", "sp", [-1, 13, 13]], ["tile_rc", "sp", [-1, 1]]]}, "result": [[7.968e-05, 8.0064e-05, 8.032e-05, 8.0384e-05, 8.0448e-05, 8.0576e-05, 8.128000000000001e-05, 8.1728e-05], 0, 12.390113592147827, 1675926454.916493], "version": 0.2, "tvm_version": "0.11.dev0"}
{"input": ["opencl -keys=adreno,opencl,gpu -device=adreno -max_num_threads=256 -texture_spatial_limit=16384 -thread_warp_size=1", "conv2d_nhwc_winograd.image2d", [["TENSOR", [1, 28, 28, 1], "float32"], ["TENSOR", [3, 3, 1, 64], "float32"], [1, 1], [0, 0, 0, 0], [1, 1], "float32"], {}], "config": {"index": 134, "code_hash": null, "entity": [["auto_unroll_max_step", "ot", 16], ["tile_y", "sp", [-1, 1, 16]], ["tile_x", "sp", [-1, 1, 13]], ["tile_rc", "sp", [-1, 1]]]}, "result": [[6.144000000000001e-05, 6.1696e-05, 6.1824e-05, 6.1952e-05, 6.2016e-05, 6.214399999999999e-05, 6.2592e-05, 6.303999999999999e-05], 0, 11.773533344268799, 1675926454.299631], "version": 0.2, "tvm_version": "0.11.dev0"}
{"input": ["opencl -keys=adreno,opencl,gpu -device=adreno -max_num_threads=256 -texture_spatial_limit=16384 -thread_warp_size=1", "conv2d_nhwc_winograd.image2d", [["TENSOR", [1, 28, 28, 1], "float32"], ["TENSOR", [3, 3, 1, 64], "float32"], [1, 1], [0, 0, 0, 0], [1, 1], "float32"], {}], "config": {"index": 163, "code_hash": null, "entity": [["auto_unroll_max_step", "ot", 4], ["tile_y", "sp", [-1, 1, 4]], ["tile_x", "sp", [-1, 13, 13]], ["tile_rc", "sp", [-1, 1]]]}, "result": [[6.5408e-05, 6.5984e-05, 6.6048e-05, 6.6048e-05, 6.623999999999999e-05, 6.6496e-05, 6.6944e-05, 6.700799999999999e-05], 0, 12.994284629821777, 1675926455.5331469], "version": 0.2, "tvm_version": "0.11.dev0"}
{"input": ["opencl -keys=adreno,opencl,gpu -device=adreno -max_num_threads=256 -texture_spatial_limit=16384 -thread_warp_size=1", "conv2d_nhwc_winograd.image2d", [["TENSOR", [1, 28, 28, 1], "float32"], ["TENSOR", [3, 3, 1, 64], "float32"], [1, 1], [0, 0, 0, 0], [1, 1], "float32"], {}], "config": {"index": 121, "code_hash": null, "entity": [["auto_unroll_max_step", "ot", 4], ["tile_y", "sp", [-1, 2, 4]], ["tile_x", "sp", [-1, 1, 13]], ["tile_rc", "sp", [-1, 1]]]}, "result": [[7.264e-05, 7.3088e-05, 7.392e-05, 7.4176e-05, 7.424e-05, 7.4368e-05, 7.4432e-05, 7.4816e-05], 0, 13.600961685180664, 1675926456.139682], "version": 0.2, "tvm_version": "0.11.dev0"}
